Title of your event,Short description,Long description,start date,start time,end date,end time,Venue,Address,Event URL,Event type
DappCon,"This years edition will focus on Ethereum core development, Universal Basic Income and of course Dapps.",,9/12/2022,8:00:00 AM,9/14/2022,8:00:00 PM,Radialsystem,"Holzmarktstraße 33, 10243 Berlin",https://www.dappcon.io/,conference
DuneCon,A day of Wizards and the wonders of blockchain data,"We’ll have a series of activities throughout the day, from hackathons & talks to training sessions and fun events.

Then we’ll wrap things up by around 18:30 before heading over to an evening venue for more socializing and merriment into the night!

This is first and foremost a Wizard event. We want to say thank you and give everybody a great day while getting to know our community better. But DuneCon is also open to prospective Wizards, partners, and industry guests.

The day is going to be a lively combination of learning, networking, socializing, and celebrating - we're going to make it a day to remember.",9/15/2022,8:00:00 AM,9/15/2022,6:30:00 PM,Funkhaus,"Nalepastraße 18, 12459 Berlin",https://www.dunecon.com/,conference
ETHBerlin³,,,9/15/2022,8:00:00 AM,9/18/2022,8:00:00 PM,Factory Görlitzer Park,"Lohmühlenstraße 65, 12435 Berlin",https://ethberlin.ooo/,conference
Borderless Berlin,There are no borders on the blockchain and our conference wants to focus on this great feature of the technology.,"Borderless is a movement to shape the future of our world with digital services for everyone. There are no borders on the blockchain and our conference wants to focus on this great feature of the technology: as citizens of different countries we all have the ability to contribute to a better world by building services that stay.
Join our movement!",9/15/2022,10:00:00 AM,9/15/2022,11:30:00 PM,Weekend Club,"Alexanderstraße 7, 10178 Berlin",https://borderless.berlin/,conference
CASA Gathering Berlin,Chain Agnostic Standards Alliance Gathering,We will have our second in-person CASA gathering at c-base in Berlin in the context of Berlin Blockchainweek 2022,9/15/2022,11:00:00 AM,9/15/2022,4:00:00 PM,c-base,"c-base Raumstation, Rungestrasse 20, (2nd backyard) · Berlin",https://github.com/ChainAgnostic/Gatherings/blob/main/2022-09-15-BLN-blockchainweek.berlin/README.md,event/meetup
ETHBerlin³ After Party!,The official ETHBerlin³ After Party 🎉,,9/18/2022,9:00:00 PM,9/19/2022,6:00:00 AM,TBD,,ethberlin.ooo,drinks/party